{"$schema":"https://json-schema.org/draft/2020-12/schema","$id":"https://scs.invalid/schemas/registry.schema.json","title":"SCS Repository Registry","type":"object","additionalProperties":false,"required":["schema_version","registry_version","operating_phase","canonical_store","definition","contexts","work_items","policy_refs","last_reconciled_commit"],"properties":{"schema_version":{"const":"scs.repo-registry.v1"},"registry_version":{"type":"integer","minimum":1},"operating_phase":{"enum":["repository_native_maturation","implementation_readiness","runtime_implementation","operational"]},"canonical_store":{"const":"git_tracked_repository_artifacts"},"definition":{"type":"string","minLength":1},"contexts":{"type":"array","items":{"$ref":"context-state.schema.json"},"minItems":1},"work_items":{"type":"array","items":{"$ref":"work-item.schema.json"}},"policy_refs":{"type":"array","items":{"type":"string"},"minItems":1},"last_reconciled_commit":{"type":"string","minLength":7},"change_note":{"type":"string"}}}
