{
  "schema_version": "scs.repo-registry.v1",
  "registry_version": 7,
  "operating_phase": "repository_native_maturation",
  "canonical_store": "git_tracked_repository_artifacts",
  "definition": "Coordinated network of independent, bounded, versioned contexts. Context states, not agents, are the fundamental units.",
  "contexts": [
    {
      "context_id": "ctx-scs-charter",
      "context_type": "system_charter",
      "title": "SCS charter and operating boundary",
      "purpose": "Define the swarm as a context-state coordination protocol; mature its state/data/workflow rules before choosing or building production runtime infrastructure.",
      "lifecycle_status": "accepted",
      "version": 2,
      "relationships": [
        {
          "type": "references",
          "target_context_id": "ctx-scs-intake"
        },
        {
          "type": "references",
          "target_context_id": "ctx-scs-repository-observation"
        }
      ],
      "evidence_refs": [
        "README.md",
        "spec/architecture.md",
        "swarm/inputs/IN-SCS-0001-operating-phase.json"
      ],
      "open_questions": [],
      "change_note": "Version 2 makes repository-native maturation canonical and defers backend/runtime implementation."
    },
    {
      "context_id": "ctx-scs-intake",
      "context_type": "intake_protocol",
      "title": "Input and task consumption protocol",
      "purpose": "Specify and test how information enters, is normalized, related, prioritized, processed, verified, and recorded.",
      "lifecycle_status": "accepted",
      "version": 7,
      "relationships": [
        {
          "type": "depends_on",
          "target_context_id": "ctx-scs-charter"
        }
      ],
      "evidence_refs": [
        "spec/swarm-operating-model.md",
        "swarm/intake-policy.json",
        "tests/fixtures/intake-scenarios.json",
        "src/scs/intake.py",
        "src/scs/transitions.py",
        "tests/test_swarm_intake.py",
        "tests/test_swarm_transitions.py",
        "schemas/registry.schema.json",
        "schemas/input-record.schema.json",
        "schemas/intake-policy.schema.json",
        "schemas/work-item.schema.json",
        "https://github.com/Loofy147/Context-swarm/actions/runs/38955118809",
        "src/scs/cycle.py",
        "tests/test_swarm_cycle.py",
        "schemas/cycle-plan.schema.json",
        "https://github.com/Loofy147/Context-swarm/actions/runs/38956865056"
      ],
      "open_questions": [
        "Validate exact source/adapter capabilities as concrete tasks arise.",
        "Revisit schema consolidation only when real examples justify a shared core."
      ],
      "change_note": "Version 7 records the integrated cycle-plan contract. Its initial CI run found a test fixture mismatch; the failure remains recorded while the fixture and output schema are corrected."
    },
    {
      "context_id": "ctx-scs-repository-demo",
      "context_type": "project",
      "title": "Repository engineering swarm demonstrator",
      "purpose": "Use the repository's real source files, Git history, metadata, specs, and tests to exercise context-state workflows without a backend.",
      "lifecycle_status": "active",
      "version": 7,
      "relationships": [
        {
          "type": "depends_on",
          "target_context_id": "ctx-scs-intake"
        },
        {
          "type": "references",
          "target_context_id": "ctx-scs-charter"
        },
        {
          "type": "references",
          "target_context_id": "ctx-scs-repository-observation"
        }
      ],
      "evidence_refs": [
        "swarm/inventory.json",
        "swarm/dependency-map.json",
        "swarm/capability-matrix.json",
        "swarm/sources/github-repository-state.json",
        "swarm/sources/recent-commit-history.json",
        "swarm/cycles/0001-bootstrap-and-intake.md",
        "README.md",
        "spec/architecture.md",
        "spec/swarm-operating-model.md",
        "tests/",
        "src/scs/cycle.py",
        "tests/test_swarm_cycle.py",
        "schemas/cycle-plan.schema.json",
        "https://github.com/Loofy147/Context-swarm/actions/runs/38956865056"
      ],
      "open_questions": [
        "Verify CI and accept the grouped-change workflow only with exact evidence.",
        "Use new real inputs to improve prioritization, conflict handling, and downstream invalidation."
      ],
      "change_note": "Version 7 records cycle planner implementation and first CI feedback; state remains in maturation and no backend is in scope."
    },
    {
      "context_id": "ctx-scs-backend-decision",
      "context_type": "deferred_decision",
      "title": "Production backend selection",
      "purpose": "Keep backend choice out of scope until repository-native swarm behavior and implementation contracts have matured.",
      "lifecycle_status": "deferred",
      "version": 2,
      "relationships": [
        {
          "type": "references",
          "target_context_id": "ctx-scs-charter"
        }
      ],
      "evidence_refs": [
        "spec/backend-decision.md"
      ],
      "open_questions": [
        "Reopen only after implementation-readiness criteria have evidence and production operational requirements are defined."
      ],
      "change_note": "Version 2 explicitly records that no backend selection, project provisioning, or deployment is part of the current phase."
    },
    {
      "context_id": "ctx-scs-repository-observation",
      "context_type": "evidence",
      "title": "Observed GitHub state for Context-swarm",
      "purpose": "Preserve source-backed metadata about the repository's visibility, default branch, branch protection, issue listing, commit history, and CI run.",
      "lifecycle_status": "accepted",
      "version": 4,
      "relationships": [
        {
          "type": "derived_from",
          "target_context_id": "ctx-scs-repository-demo"
        }
      ],
      "evidence_refs": [
        "swarm/sources/github-repository-state.json",
        "swarm/sources/recent-commit-history.json",
        "swarm/dependency-map.json",
        "swarm/inventory.json",
        "https://api.github.com/repos/Loofy147/Context-swarm/commits?per_page=30",
        "https://github.com/Loofy147/Context-swarm/actions/runs/38955118809",
        "https://github.com/Loofy147/Context-swarm/actions/runs/38956067934",
        "https://github.com/Loofy147/Context-swarm/commit/8f0a4c597a9eef7ba24dd50bcde8fd68a2e6737f"
      ],
      "open_questions": [
        "Refresh source observations on material revisions and mark old observations stale.",
        "The main branch is not protected; procedural review is not server-enforced."
      ],
      "change_note": "Version 4 appends successful CI evidence for the grouped schema/capability/inventory update; metadata observations remain time-bounded."
    },
    {
      "context_id": "ctx-scs-capabilities",
      "context_type": "source_capability_policy",
      "title": "Source and operation capability boundaries",
      "purpose": "Define which reads, repository writes, connected-service operations, and privileged actions may be considered in a specific operator run.",
      "lifecycle_status": "accepted",
      "version": 2,
      "relationships": [
        {
          "type": "depends_on",
          "target_context_id": "ctx-scs-charter"
        },
        {
          "type": "references",
          "target_context_id": "ctx-scs-intake"
        }
      ],
      "evidence_refs": [
        "swarm/capability-matrix.json",
        "schemas/capability-matrix.schema.json",
        "spec/swarm-operating-model.md",
        "https://github.com/Loofy147/Context-swarm/actions/runs/38956067934"
      ],
      "open_questions": [
        "For each future non-repository source, verify its exact current tool action, resource scope and read/write permission before processing a task."
      ],
      "change_note": "Version 2 accepted after the capability matrix schema and no-universal-access/read-write separation tests passed in GitHub Actions."
    }
  ],
  "work_items": [
    {
      "work_item_id": "SCS-MATURE-001",
      "kind": "specification_review",
      "title": "Audit existing repository artifacts against the repository-native operating model",
      "status": "accepted",
      "requested_by": "user_direction",
      "source_refs": [
        "README.md",
        "spec/architecture.md",
        "spec/openapi.yaml",
        "migrations/001_initial_postgres.sql",
        "src/scs/reference_model.py",
        "tests/",
        "swarm/inventory.json"
      ],
      "target_context_ids": [
        "ctx-scs-repository-demo",
        "ctx-scs-charter"
      ],
      "dependencies": [],
      "priority": {
        "level": "high",
        "rationale": "Detect contradictory or premature artifacts before extending the protocol."
      },
      "acceptance_criteria": [
        "Every artifact in the reviewed tree is classified.",
        "Contradictions are recorded with paths and a disposition.",
        "No files are silently deleted."
      ],
      "required_evidence": [
        "swarm/inventory.json reviewed_tree_commit 481fe14acada05c55cf08166c895c4440725f359",
        "INV-001 through INV-004 findings"
      ],
      "attempts": 1,
      "blocked_reason": null,
      "last_outcome": "Accepted: inventory classifies current, deferred, reference-only, and alignment-needed artifacts; four findings record disposition and follow-up.",
      "history_refs": [
        "https://github.com/Loofy147/Context-swarm/commit/47903b4cf53801d60e219ebc26e9d1357458b06b",
        "https://github.com/Loofy147/Context-swarm/commit/ae9eeb4d6f496e3e48ef79bd667aad9cc3de7313"
      ],
      "version": 2
    },
    {
      "work_item_id": "SCS-MATURE-002",
      "kind": "verification",
      "title": "Add replayable intake and context-state transition cases",
      "status": "accepted",
      "requested_by": "swarm_registry_seed",
      "source_refs": [